{
  "type": "surveillance.alert.created",
  "topic": "surveillance.alert.created",
  "correlationId": "demo-websocket-alert-001",
  "timestamp": "2026-06-09T10:02:00Z",
  "payload": {
    "alertId": "alert-demo-001",
    "ruleName": "LargeOrderRule",
    "severity": "HIGH",
    "status": "OPEN",
    "correlationId": "demo-websocket-alert-001"
  }
}
